{
  "schemaVersion": 1,
  "id": "s_20260720_lighthouse_in_a_storm",
  "title": "Lighthouse in a Storm",
  "status": "exploring",
  "phase": "exploration",
  "createdAt": "2026-07-20T07:24:20.527Z",
  "updatedAt": "2026-07-20T07:45:40.533Z",
  "engine": {
    "name": "kaplay",
    "version": "4000.0.0-alpha.27.1"
  },
  "activeObjectiveRevision": 1,
  "nextNodeSequence": 4
}
